{
  "audio": {
    "all_silent": false,
    "channels": 1,
    "clipping_sample_ratio": 0.0,
    "duration_seconds": 3.2,
    "file": "qwen-voice-design-bf16-smoke.wav",
    "format": "wav-pcm",
    "frames": 76800,
    "peak_normalized": 0.691427351,
    "rms_normalized": 0.110700754,
    "sample_rate_hz": 24000,
    "sample_width_bytes": 2,
    "schema_version": 1,
    "sha256": "a998c90bc521e1bf9bfcbf72fbf0c96d97a13c482cbd315ad03bc920dbdc2b73",
    "silent_frame_ratio": 0.183997396,
    "size_bytes": 153644,
    "warnings": []
  },
  "checks": [
    {
      "detail": "SHA-256 and byte-size match pipeline result",
      "id": "audio_integrity",
      "status": "PASS"
    },
    {
      "detail": "manifest identity, audio digest, size and WAV metadata match",
      "id": "manifest_integrity",
      "status": "PASS"
    },
    {
      "detail": "pipeline duration matches decoded WAV duration",
      "id": "duration_match",
      "status": "PASS"
    },
    {
      "detail": "duration=3.200000s; expected [0.5, 15.0]s",
      "id": "duration",
      "status": "PASS"
    },
    {
      "detail": "silent_frame_ratio=0.183997; maximum=0.97",
      "id": "silence_ratio",
      "status": "PASS"
    },
    {
      "detail": "clipping_sample_ratio=0.000000; maximum=0.01",
      "id": "clipping_ratio",
      "status": "PASS"
    },
    {
      "detail": "WAV decoded and PCM frame count verified",
      "id": "audio_decode",
      "status": "PASS"
    }
  ],
  "engine_id": "qwen3_tts",
  "inference_verified": true,
  "request_id": "qwen-cpu-bf16-smoke-20261010",
  "schema_version": 1,
  "status": "PASS",
  "worker_return_code": 0
}
